{
  "id": "topic-10",
  "name": "Deductive Logic",
  "topicId": "philosophy.philosophy-foundations.chapter-13.topic-10",
  "description": "Learn about Deductive Logic and its applications in philosophy.",
  "content": {
    "overview": "Deductive Logic is a fundamental concept in philosophy. {{viz:diagram-01}}",
    "explanation": "This topic covers the essential aspects of Deductive Logic. Let's start with the basic definition {{viz:formula-01}} and then explore the interactive model {{viz:3d-01}}. \n          \nAs you can see from the animation {{viz:anim-01}}, the concept behaves in a specific way. The data visualization {{viz:chart-01}} shows real-world applications.\n\nUnderstanding Deductive Logic requires both theoretical knowledge {{viz:text-01}} and practical exploration {{viz:simulation-01}}.",
    "keyPoints": [
      "Understanding the basics {{viz:diagram-02}}",
      "Practical applications {{viz:example-01}}",
      "Common misconceptions"
    ],
    "whyItMatters": "Deductive Logic is essential for mastering Philosophy Foundations."
  }
}